<?xml version="1.0" encoding="UTF-8"?>
<xs:schema xmlns:xs="http://www.w3.org/2001/XMLSchema">

	<xs:element name="editor">
	    <xs:complexType>
    		<xs:choice minOccurs="1" maxOccurs="unbounded">
    			<xs:element name="group" type="group"/>
    			<xs:element name="custom-group" type="custom-group"/>
    		</xs:choice>
    	</xs:complexType>
    </xs:element>

    <xs:complexType name="group">
    	<xs:sequence>
    		<xs:element name="label" type="label" minOccurs="0" maxOccurs="unbounded"/>
    		<xs:element name="property" type="property" minOccurs="0" maxOccurs="unbounded"/>
    	</xs:sequence>
    	<xs:attribute name="qualifier" type="xs:string" use="required"/>
    	<xs:attribute name="visible" type="xs:boolean" use="optional" default="true"/>
    	<xs:attribute name="tabbed" type="xs:boolean" use="optional" default="false"/>
    	<xs:attribute name="initially-opened" type="xs:boolean" use="optional" default="true"/>
    	<xs:attribute name="show-if-empty" type="xs:boolean" use="optional" default="true"/>
    	<xs:attribute name="show-in-create-mode" type="xs:boolean" use="optional" default="true"/>
    	<xs:attribute name="position" type="xs:positiveInteger" use="optional" default="1"/>
    	<xs:attribute name="printable" type="xs:boolean" use="optional" default="true"/>
    	<xs:attribute name="xmlDataProvider" type="xs:string" use="optional" default="xmlDataProvider"/>
    </xs:complexType>
    
    <xs:complexType name="custom-group">
    	<xs:sequence>
    		<xs:element name="label" type="label" minOccurs="0" maxOccurs="unbounded"/>
    	</xs:sequence>
    	<xs:attribute name="qualifier" type="xs:string" use="required"/>
    	<xs:attribute name="visible" type="xs:boolean" use="optional" default="true"/>
    	<xs:attribute name="class" type="xs:string" use="optional"/>
    	<xs:attribute name="spring-bean" type="xs:string" use="optional"/>
    	<xs:attribute name="initially-opened" type="xs:boolean" use="optional" default="true"/>
    	<xs:attribute name="show-if-empty" type="xs:boolean" use="optional" default="true"/>
    	<xs:attribute name="printable" type="xs:boolean" use="optional" default="true"/>
    	<xs:attribute name="xmlDataProvider" type="xs:string" use="optional" default="xmlDataProvider"/>
    </xs:complexType>
    
    <xs:complexType name="label">
    	<xs:simpleContent>
    		<xs:extension base="xs:string">
    			<xs:attribute name="key" use="optional" type="xs:string" />
    			<xs:attribute name="lang" use="optional" type="xs:string" />
    		</xs:extension>
    	</xs:simpleContent>
    </xs:complexType>

    <xs:complexType name="property">
    	<xs:sequence>
    		<xs:element name="parameter" type="parameter" minOccurs="0" maxOccurs="unbounded"/>
    	</xs:sequence>
    	<xs:attribute name="qualifier" type="xs:string" use="required"/>
    	<xs:attribute name="visible" type="xs:boolean" use="optional" default="true"/>
    	<xs:attribute name="editor" type="xs:string" use="optional"/>
    	<xs:attribute name="printoutas" type="xs:string" use="optional"/>
    	<xs:attribute name="xmlDataProvider" type="xs:string" use="optional" default="xmlDataProvider"/>
    </xs:complexType> 
    
    <xs:complexType name="parameter">
    	<xs:sequence>
    		<xs:element name="name" type="name"/>
    		<xs:element name="value" type="value"/>
    	</xs:sequence>
    </xs:complexType>
    
    <xs:simpleType name="name">
    	<xs:restriction base="xs:string"/>
    </xs:simpleType>
    
    <xs:simpleType name="value">
       	<xs:restriction base="xs:string"/> 
    </xs:simpleType>
    
</xs:schema>