<?xml version="1.0" encoding="UTF-8"?>
<editor xmlns:xsi="http://www.w3.org/2001/XMLSchema-instance" xsi:noNamespaceSchemaLocation="editor.xsd">
	<group qualifier="General" visible="true" initially-opened="true">
		<label key="cockpit.config.label.General" />
		<property qualifier="cmsitem.name"/>
		<property qualifier="cmsitem.uid"/>
		<property qualifier="cmsitem.catalogVersion" editor="shortListEditor"/>
		<property qualifier="AbstractCMSComponent.visible"/>
		<property qualifier="AbstractCMSComponent.type"/>
		<property qualifier="AbstractCMSComponent.typeCode"/>
		<property qualifier="AbstractCMSComponent.container"/>
		<property qualifier="pagetemplate.active"/>
		<property qualifier="pagetemplate.contentSlots"/>
	</group>

	<group qualifier="admin" visible="true" initially-opened="false">
		<label key="config.general.administration" />
		<property qualifier="Item.pk" />
		<property qualifier="Item.creationTime" />
		<property qualifier="Item.modifiedtime" />
	</group>
	
	<custom-group 
		class="de.hybris.platform.cockpit.services.config.impl.UnassignedEditorSectionConfiguration" 
		qualifier="unassigned"
		initially-opened="false">
		<label key="cockpit.config.label.Other" />
	</custom-group>
</editor>
